{
 "schema": "urn:citerift:schema:wiki:v1:verification",
 "schema_version": "1.0.0",
 "operation": "verify",
 "capture_sha256": "eb8b3ffc92ee078074585059bcd2f77989e33e174b6ab5a00d3a9b4f251c99f0",
 "verified": true,
 "extraction_digest": "9f326293763b4aa387839fa0f12594069a889ba7b315216260d5922802bd5429",
 "checks": [
  {
   "name": "a cited-work field comes from a citation template field",
   "checked": 6,
   "failed": 0,
   "first_failure": null
  },
  {
   "name": "a marker target lies inside a marker template",
   "checked": 4,
   "failed": 0,
   "first_failure": null
  },
  {
   "name": "an identifier inside a marker template is a marker target",
   "checked": 4,
   "failed": 0,
   "first_failure": null
  },
  {
   "name": "artifact hashes",
   "checked": 3,
   "failed": 0,
   "first_failure": null
  },
  {
   "name": "attempt hosts",
   "checked": 2,
   "failed": 0,
   "first_failure": null
  },
  {
   "name": "capture status",
   "checked": 1,
   "failed": 0,
   "first_failure": null
  },
  {
   "name": "config digest",
   "checked": 1,
   "failed": 0,
   "first_failure": null
  },
  {
   "name": "container units exist",
   "checked": 33,
   "failed": 0,
   "first_failure": null
  },
  {
   "name": "container uses exist",
   "checked": 39,
   "failed": 0,
   "first_failure": null
  },
  {
   "name": "containers by kind",
   "checked": 1,
   "failed": 0,
   "first_failure": null
  },
  {
   "name": "exact source anchors",
   "checked": 10,
   "failed": 0,
   "first_failure": null
  },
  {
   "name": "extraction capture fields",
   "checked": 1,
   "failed": 0,
   "first_failure": null
  },
  {
   "name": "extraction digest",
   "checked": 1,
   "failed": 0,
   "first_failure": null
  },
  {
   "name": "extraction names this capture",
   "checked": 1,
   "failed": 0,
   "first_failure": null
  },
  {
   "name": "identifier container exists",
   "checked": 10,
   "failed": 0,
   "first_failure": null
  },
  {
   "name": "identifier unit lists it",
   "checked": 6,
   "failed": 0,
   "first_failure": null
  },
  {
   "name": "identifiers by role",
   "checked": 1,
   "failed": 0,
   "first_failure": null
  },
  {
   "name": "identifiers by scheme",
   "checked": 1,
   "failed": 0,
   "first_failure": null
  },
  {
   "name": "marker browser visibility not evaluated",
   "checked": 33,
   "failed": 0,
   "first_failure": null
  },
  {
   "name": "marker containers from retained source",
   "checked": 1,
   "failed": 0,
   "first_failure": null
  },
  {
   "name": "marker context reproduces",
   "checked": 33,
   "failed": 0,
   "first_failure": null
  },
  {
   "name": "marker evidence kind follows its part",
   "checked": 5,
   "failed": 0,
   "first_failure": null
  },
  {
   "name": "marker evidence quotes its element",
   "checked": 5,
   "failed": 0,
   "first_failure": null
  },
  {
   "name": "marker reconstruction completed",
   "checked": 1,
   "failed": 0,
   "first_failure": null
  },
  {
   "name": "marker region follows retained binding",
   "checked": 33,
   "failed": 0,
   "first_failure": null
  },
  {
   "name": "marker state follows its evidence",
   "checked": 33,
   "failed": 0,
   "first_failure": null
  },
  {
   "name": "markers by state",
   "checked": 1,
   "failed": 0,
   "first_failure": null
  },
  {
   "name": "normalization is the Stage 02 normalizer's result",
   "checked": 10,
   "failed": 0,
   "first_failure": null
  },
  {
   "name": "one marker observation per container",
   "checked": 1,
   "failed": 0,
   "first_failure": null
  },
  {
   "name": "page wiki is the requested wiki",
   "checked": 1,
   "failed": 0,
   "first_failure": null
  },
  {
   "name": "pinned revision",
   "checked": 1,
   "failed": 0,
   "first_failure": null
  },
  {
   "name": "recorded accounting checks hold",
   "checked": 8,
   "failed": 0,
   "first_failure": null
  },
  {
   "name": "render URL",
   "checked": 1,
   "failed": 0,
   "first_failure": null
  },
  {
   "name": "render body is the accepted attempt",
   "checked": 1,
   "failed": 0,
   "first_failure": null
  },
  {
   "name": "render checks reproduce",
   "checked": 1,
   "failed": 0,
   "first_failure": null
  },
  {
   "name": "render locators",
   "checked": 88,
   "failed": 0,
   "first_failure": null
  },
  {
   "name": "render requested",
   "checked": 1,
   "failed": 0,
   "first_failure": null
  },
  {
   "name": "render size",
   "checked": 1,
   "failed": 0,
   "first_failure": null
  },
  {
   "name": "render state follows its checks",
   "checked": 1,
   "failed": 0,
   "first_failure": null
  },
  {
   "name": "request is valid",
   "checked": 1,
   "failed": 0,
   "first_failure": null
  },
  {
   "name": "schema capture",
   "checked": 1,
   "failed": 0,
   "first_failure": null
  },
  {
   "name": "schema extraction",
   "checked": 1,
   "failed": 0,
   "first_failure": null
  },
  {
   "name": "source SHA-1",
   "checked": 1,
   "failed": 0,
   "first_failure": null
  },
  {
   "name": "source URL",
   "checked": 1,
   "failed": 0,
   "first_failure": null
  },
  {
   "name": "source answer is the accepted attempt",
   "checked": 1,
   "failed": 0,
   "first_failure": null
  },
  {
   "name": "source answer states the recorded revision",
   "checked": 1,
   "failed": 0,
   "first_failure": null
  },
  {
   "name": "source size",
   "checked": 1,
   "failed": 0,
   "first_failure": null
  },
  {
   "name": "source spans",
   "checked": 171,
   "failed": 0,
   "first_failure": null
  },
  {
   "name": "unique containers ids",
   "checked": 1,
   "failed": 0,
   "first_failure": null
  },
  {
   "name": "unique identifiers ids",
   "checked": 1,
   "failed": 0,
   "first_failure": null
  },
  {
   "name": "unique units ids",
   "checked": 1,
   "failed": 0,
   "first_failure": null
  },
  {
   "name": "unique uses ids",
   "checked": 1,
   "failed": 0,
   "first_failure": null
  },
  {
   "name": "unit identifiers exist",
   "checked": 6,
   "failed": 0,
   "first_failure": null
  },
  {
   "name": "use container exists and lists the use",
   "checked": 39,
   "failed": 0,
   "first_failure": null
  },
  {
   "name": "uses by binding",
   "checked": 1,
   "failed": 0,
   "first_failure": null
  }
 ],
 "issues": []
}
