{
 "schema": "urn:citerift:schema:wiki:v1:verification",
 "schema_version": "1.0.0",
 "operation": "replay",
 "capture_sha256": "213844e484a0f9bd224f84aa40f95df9d4d3bde21b43bc3b926d99f7fae99ceb",
 "verified": true,
 "replay": {
  "new_status": "partial",
  "new_digest": "eecc81a2882e176e38cbde082a342e16e2707e5980d40adade706c1239f36819",
  "recorded_digest": "eecc81a2882e176e38cbde082a342e16e2707e5980d40adade706c1239f36819",
  "state": "reproduced"
 },
 "extraction_digest": "eecc81a2882e176e38cbde082a342e16e2707e5980d40adade706c1239f36819",
 "checks": [
  {
   "name": "schema extraction",
   "checked": 1,
   "failed": 0,
   "first_failure": null
  }
 ],
 "issues": []
}
