{
 "schema": "urn:citerift:schema:wiki:v1:verification",
 "schema_version": "1.0.0",
 "operation": "replay",
 "capture_sha256": "3d4f91b1866cc399d9b562fa054a028707389523e4d270afe635e9a6427b33ae",
 "verified": true,
 "replay": {
  "new_status": "complete",
  "new_digest": "0c5c94532846ea3da57e51273bd17f1ef2c07428cbe9fdbb9b77358dcf5d5513",
  "recorded_digest": "0c5c94532846ea3da57e51273bd17f1ef2c07428cbe9fdbb9b77358dcf5d5513",
  "state": "reproduced"
 },
 "extraction_digest": "0c5c94532846ea3da57e51273bd17f1ef2c07428cbe9fdbb9b77358dcf5d5513",
 "checks": [
  {
   "name": "schema extraction",
   "checked": 1,
   "failed": 0,
   "first_failure": null
  }
 ],
 "issues": []
}
