{
  "schema": "urn:citerift:schema:wiki:v1:verification",
  "schema_version": "1.0.0",
  "operation": "replay",
  "capture_sha256": "63df6e9053c5fc9822940e13e1aec22452228323d7b708e7e37b1c7f6cdc9127",
  "verified": false,
  "replay": {
    "new_status": "complete",
    "new_digest": "b94dec2e0eb08cdab3583fb0a8336b0a02ff5dbb36e43857d9328c5f07078e1b",
    "recorded_digest": "eda9a967035e1519c2946ca6b286f41d035f16b0f8a296e69a20d0a6f191204d",
    "differing_keys": [
      "accounting",
      "markers"
    ],
    "state": "differs"
  },
  "extraction_digest": "b94dec2e0eb08cdab3583fb0a8336b0a02ff5dbb36e43857d9328c5f07078e1b",
  "checks": [
    {
      "name": "schema extraction",
      "checked": 1,
      "failed": 0,
      "first_failure": null
    }
  ],
  "issues": [
    {
      "code": "REPLAY_DIFFERS",
      "severity": "error",
      "retryable": false,
      "entities": [],
      "detail": "differs in accounting, markers",
      "evidence": []
    }
  ]
}
