{
  "schema": "urn:citerift:schema:wiki:v1:verification",
  "schema_version": "1.0.0",
  "operation": "replay",
  "capture_sha256": "130490382b8a390add0c36a064d70e888afb8cfc7d4addc33512763ae4265581",
  "verified": true,
  "replay": {
    "new_status": "complete",
    "new_digest": "3ef0686624d883a30d670535896dd71ee935741fe81c6a9a799faa03d97b180f",
    "recorded_digest": "3ef0686624d883a30d670535896dd71ee935741fe81c6a9a799faa03d97b180f",
    "state": "reproduced"
  },
  "extraction_digest": "3ef0686624d883a30d670535896dd71ee935741fe81c6a9a799faa03d97b180f",
  "checks": [
    {
      "name": "schema extraction",
      "checked": 1,
      "failed": 0,
      "first_failure": null
    }
  ],
  "issues": []
}
