{
 "schema": "urn:citerift:schema:wiki:v1:verification",
 "schema_version": "1.0.0",
 "operation": "replay",
 "capture_sha256": "8f4f53c9291d02b8c3e177ea68c5ad49998c6b56ea743fc2e4f1c264e64429cd",
 "verified": true,
 "replay": {
  "new_status": "partial",
  "new_digest": "22c00874518fd775a63d9343e1e1d66b2a4ac4e207bd4fe11e989f96fb55fa7b",
  "recorded_digest": "22c00874518fd775a63d9343e1e1d66b2a4ac4e207bd4fe11e989f96fb55fa7b",
  "state": "reproduced"
 },
 "extraction_digest": "22c00874518fd775a63d9343e1e1d66b2a4ac4e207bd4fe11e989f96fb55fa7b",
 "checks": [
  {
   "name": "schema extraction",
   "checked": 1,
   "failed": 0,
   "first_failure": null
  }
 ],
 "issues": []
}
