{
  "schema": "urn:citerift:schema:wiki:v1:verification",
  "schema_version": "1.0.0",
  "operation": "verify",
  "capture_sha256": "749bfbeb8bc40c98ac2bec32081d4b985d01ace07a9899c332f609563584d131",
  "verified": true,
  "extraction_digest": "692f04710835916331d5d5c2315a9ed0a7a86ee3adf1721a3354c2378e49b4d9",
  "checks": [
    {
      "name": "artifact hashes",
      "checked": 3,
      "failed": 0,
      "first_failure": null
    },
    {
      "name": "attempt hosts",
      "checked": 2,
      "failed": 0,
      "first_failure": null
    },
    {
      "name": "capture status",
      "checked": 1,
      "failed": 0,
      "first_failure": null
    },
    {
      "name": "config digest",
      "checked": 1,
      "failed": 0,
      "first_failure": null
    },
    {
      "name": "container units exist",
      "checked": 1,
      "failed": 0,
      "first_failure": null
    },
    {
      "name": "container uses exist",
      "checked": 1,
      "failed": 0,
      "first_failure": null
    },
    {
      "name": "containers by kind",
      "checked": 1,
      "failed": 0,
      "first_failure": null
    },
    {
      "name": "extraction capture fields",
      "checked": 1,
      "failed": 0,
      "first_failure": null
    },
    {
      "name": "extraction digest",
      "checked": 1,
      "failed": 0,
      "first_failure": null
    },
    {
      "name": "extraction names this capture",
      "checked": 1,
      "failed": 0,
      "first_failure": null
    },
    {
      "name": "identifiers by role",
      "checked": 1,
      "failed": 0,
      "first_failure": null
    },
    {
      "name": "identifiers by scheme",
      "checked": 1,
      "failed": 0,
      "first_failure": null
    },
    {
      "name": "marker browser visibility not evaluated",
      "checked": 1,
      "failed": 0,
      "first_failure": null
    },
    {
      "name": "marker evidence kind follows its part",
      "checked": 1,
      "failed": 0,
      "first_failure": null
    },
    {
      "name": "marker evidence quotes its element",
      "checked": 1,
      "failed": 0,
      "first_failure": null
    },
    {
      "name": "marker state follows its evidence",
      "checked": 1,
      "failed": 0,
      "first_failure": null
    },
    {
      "name": "markers by state",
      "checked": 1,
      "failed": 0,
      "first_failure": null
    },
    {
      "name": "one marker observation per container",
      "checked": 1,
      "failed": 0,
      "first_failure": null
    },
    {
      "name": "page wiki is the requested wiki",
      "checked": 1,
      "failed": 0,
      "first_failure": null
    },
    {
      "name": "pinned revision",
      "checked": 1,
      "failed": 0,
      "first_failure": null
    },
    {
      "name": "recorded accounting checks hold",
      "checked": 8,
      "failed": 0,
      "first_failure": null
    },
    {
      "name": "render URL",
      "checked": 1,
      "failed": 0,
      "first_failure": null
    },
    {
      "name": "render body is the accepted attempt",
      "checked": 1,
      "failed": 0,
      "first_failure": null
    },
    {
      "name": "render checks reproduce",
      "checked": 1,
      "failed": 0,
      "first_failure": null
    },
    {
      "name": "render locators",
      "checked": 3,
      "failed": 0,
      "first_failure": null
    },
    {
      "name": "render requested",
      "checked": 1,
      "failed": 0,
      "first_failure": null
    },
    {
      "name": "render size",
      "checked": 1,
      "failed": 0,
      "first_failure": null
    },
    {
      "name": "render state follows its checks",
      "checked": 1,
      "failed": 0,
      "first_failure": null
    },
    {
      "name": "request is valid",
      "checked": 1,
      "failed": 0,
      "first_failure": null
    },
    {
      "name": "schema capture",
      "checked": 1,
      "failed": 0,
      "first_failure": null
    },
    {
      "name": "schema extraction",
      "checked": 1,
      "failed": 0,
      "first_failure": null
    },
    {
      "name": "source SHA-1",
      "checked": 1,
      "failed": 0,
      "first_failure": null
    },
    {
      "name": "source URL",
      "checked": 1,
      "failed": 0,
      "first_failure": null
    },
    {
      "name": "source answer is the accepted attempt",
      "checked": 1,
      "failed": 0,
      "first_failure": null
    },
    {
      "name": "source answer states the recorded revision",
      "checked": 1,
      "failed": 0,
      "first_failure": null
    },
    {
      "name": "source size",
      "checked": 1,
      "failed": 0,
      "first_failure": null
    },
    {
      "name": "source spans",
      "checked": 5,
      "failed": 0,
      "first_failure": null
    },
    {
      "name": "unique containers ids",
      "checked": 1,
      "failed": 0,
      "first_failure": null
    },
    {
      "name": "unique identifiers ids",
      "checked": 1,
      "failed": 0,
      "first_failure": null
    },
    {
      "name": "unique units ids",
      "checked": 1,
      "failed": 0,
      "first_failure": null
    },
    {
      "name": "unique uses ids",
      "checked": 1,
      "failed": 0,
      "first_failure": null
    },
    {
      "name": "use container exists and lists the use",
      "checked": 1,
      "failed": 0,
      "first_failure": null
    },
    {
      "name": "uses by binding",
      "checked": 1,
      "failed": 0,
      "first_failure": null
    }
  ],
  "issues": []
}
