{
 "schema": "urn:citerift:schema:wiki:v1:verification",
 "schema_version": "1.0.0",
 "operation": "replay",
 "capture_sha256": "72aaf7ce7891310bab11a9098a2ff7b67af41d290fa3effd920e71adc96d6121",
 "verified": true,
 "replay": {
  "new_status": "complete",
  "new_digest": "823364d938e88da250c2ef95b0a832bb9fbbae699fd66cc79413ff6ca4eb5ac5",
  "recorded_digest": "823364d938e88da250c2ef95b0a832bb9fbbae699fd66cc79413ff6ca4eb5ac5",
  "state": "reproduced"
 },
 "extraction_digest": "823364d938e88da250c2ef95b0a832bb9fbbae699fd66cc79413ff6ca4eb5ac5",
 "checks": [
  {
   "name": "schema extraction",
   "checked": 1,
   "failed": 0,
   "first_failure": null
  }
 ],
 "issues": []
}
