{
 "schema": "urn:citerift:schema:wiki:v1:verification",
 "schema_version": "1.0.0",
 "operation": "replay",
 "capture_sha256": "daa261f39598cf08d0bece08cb94cbd680b83c91fe67232765ababd26af16562",
 "verified": true,
 "replay": {
  "new_status": "partial",
  "new_digest": "1db7cbaeb7fed71530a50863ec2a9c6480d42ccade8cb13f29def7b1bf9040dd",
  "recorded_digest": "1db7cbaeb7fed71530a50863ec2a9c6480d42ccade8cb13f29def7b1bf9040dd",
  "state": "reproduced"
 },
 "extraction_digest": "1db7cbaeb7fed71530a50863ec2a9c6480d42ccade8cb13f29def7b1bf9040dd",
 "checks": [
  {
   "name": "schema extraction",
   "checked": 1,
   "failed": 0,
   "first_failure": null
  }
 ],
 "issues": []
}
