{
  "capture_sha256": "63df6e9053c5fc9822940e13e1aec22452228323d7b708e7e37b1c7f6cdc9127",
  "checks": [
    {
      "checked": 1,
      "failed": 0,
      "first_failure": null,
      "name": "schema extraction"
    }
  ],
  "extraction_digest": "b94dec2e0eb08cdab3583fb0a8336b0a02ff5dbb36e43857d9328c5f07078e1b",
  "issues": [],
  "operation": "replay",
  "replay": {
    "new_digest": "b94dec2e0eb08cdab3583fb0a8336b0a02ff5dbb36e43857d9328c5f07078e1b",
    "new_status": "complete",
    "recorded_digest": "b94dec2e0eb08cdab3583fb0a8336b0a02ff5dbb36e43857d9328c5f07078e1b",
    "state": "reproduced"
  },
  "schema": "urn:citerift:schema:wiki:v1:verification",
  "schema_version": "1.0.0",
  "verified": true
}
