{
 "schema": "urn:citerift:schema:wiki:v1:verification",
 "schema_version": "1.0.0",
 "operation": "replay",
 "capture_sha256": "8dcd7719dcf65ec56d764b2665177f6a426a2ed387200933f65f4d2953403c72",
 "verified": true,
 "replay": {
  "new_status": "complete",
  "new_digest": "8af0e8e39359930dbcc36cf5f516e67d4f3b5c2b19fcfaa57dbfbfbad8321d25",
  "recorded_digest": "8af0e8e39359930dbcc36cf5f516e67d4f3b5c2b19fcfaa57dbfbfbad8321d25",
  "state": "reproduced"
 },
 "extraction_digest": "8af0e8e39359930dbcc36cf5f516e67d4f3b5c2b19fcfaa57dbfbfbad8321d25",
 "checks": [
  {
   "name": "schema extraction",
   "checked": 1,
   "failed": 0,
   "first_failure": null
  }
 ],
 "issues": []
}
