{
 "schema": "urn:citerift:schema:wiki:v1:verification",
 "schema_version": "1.0.0",
 "operation": "replay",
 "capture_sha256": "94aa874d21a8a012d885b6ad61d32dc5e501a15d17a43995b7777dc33d3711ba",
 "verified": true,
 "replay": {
  "new_status": "complete",
  "new_digest": "d34f14fe072c93cd97cdab4d0d995676f53c8e923011e57d9ca2e355624c7e6d",
  "recorded_digest": "d34f14fe072c93cd97cdab4d0d995676f53c8e923011e57d9ca2e355624c7e6d",
  "state": "reproduced"
 },
 "extraction_digest": "d34f14fe072c93cd97cdab4d0d995676f53c8e923011e57d9ca2e355624c7e6d",
 "checks": [
  {
   "name": "schema extraction",
   "checked": 1,
   "failed": 0,
   "first_failure": null
  }
 ],
 "issues": []
}
