{
 "schema": "urn:citerift:schema:wiki:v1:verification",
 "schema_version": "1.0.0",
 "operation": "replay",
 "capture_sha256": "24166935bd8751723e6cec3aac6c433f11df758089d62e5f9291a2578c0ad45e",
 "verified": true,
 "replay": {
  "new_status": "complete",
  "new_digest": "0c14e0d227f9186c10f8d0305bb53512d348112763e3dbdc394021b2db83e49a",
  "recorded_digest": "0c14e0d227f9186c10f8d0305bb53512d348112763e3dbdc394021b2db83e49a",
  "state": "reproduced"
 },
 "extraction_digest": "0c14e0d227f9186c10f8d0305bb53512d348112763e3dbdc394021b2db83e49a",
 "checks": [
  {
   "name": "schema extraction",
   "checked": 1,
   "failed": 0,
   "first_failure": null
  }
 ],
 "issues": []
}
