{
 "schema": "urn:citerift:schema:wiki:v1:verification",
 "schema_version": "1.0.0",
 "operation": "replay",
 "capture_sha256": "53b999e43a2542687ce3d2d7fc32ef62c3acc1d7edb7e7ecf9fda61546a13c67",
 "verified": true,
 "replay": {
  "new_status": "complete",
  "new_digest": "d825980891d8473f160764b150f4731fab008be68fd87194939374f7748b2fcb",
  "recorded_digest": "d825980891d8473f160764b150f4731fab008be68fd87194939374f7748b2fcb",
  "state": "reproduced"
 },
 "extraction_digest": "d825980891d8473f160764b150f4731fab008be68fd87194939374f7748b2fcb",
 "checks": [
  {
   "name": "schema extraction",
   "checked": 1,
   "failed": 0,
   "first_failure": null
  }
 ],
 "issues": []
}
