{
 "schema": "urn:citerift:schema:wiki:v1:verification",
 "schema_version": "1.0.0",
 "operation": "replay",
 "capture_sha256": "085ff02200d981ef0caa84f65b370044b974eada6fd1a1584b67c210aa224b89",
 "verified": true,
 "replay": {
  "new_status": "complete",
  "new_digest": "09cc773e943fcbaa350a5cc45dfec677de6bc2fef3c7bc28ec2aa41993397447",
  "recorded_digest": "09cc773e943fcbaa350a5cc45dfec677de6bc2fef3c7bc28ec2aa41993397447",
  "state": "reproduced"
 },
 "extraction_digest": "09cc773e943fcbaa350a5cc45dfec677de6bc2fef3c7bc28ec2aa41993397447",
 "checks": [
  {
   "name": "schema extraction",
   "checked": 1,
   "failed": 0,
   "first_failure": null
  }
 ],
 "issues": []
}
