{
 "schema": "urn:citerift:schema:wiki:v1:verification",
 "schema_version": "1.0.0",
 "operation": "replay",
 "capture_sha256": "69f5a32589b0f2a06adc0b00a3a8e150bc1f6dec7c37c864a3f8218ab60e625d",
 "verified": true,
 "replay": {
  "new_status": "complete",
  "new_digest": "a0ddafc3717c900fe0752c46e150274ad8865bd8f2b672cd850bc0a3b7cdb7ec",
  "recorded_digest": "a0ddafc3717c900fe0752c46e150274ad8865bd8f2b672cd850bc0a3b7cdb7ec",
  "state": "reproduced"
 },
 "extraction_digest": "a0ddafc3717c900fe0752c46e150274ad8865bd8f2b672cd850bc0a3b7cdb7ec",
 "checks": [
  {
   "name": "schema extraction",
   "checked": 1,
   "failed": 0,
   "first_failure": null
  }
 ],
 "issues": []
}
